{
  "$schema": "https://json-schema.org/draft/2020-12/schema",
  "$id": "https://api.tarlaanaliz.com/schemas/events/expert_review_decided.v1.schema.json",
  "title": "ExpertReviewDecidedEvent",
  "description": "Domain event: an expert submitted a verdict for an analysis review (KR-019). This event is the GATE: an approving outcome (gate_outcome=APPROVED_PUBLISHED) authorises farmer-facing publication of the result (mission→DELIVERED, dataset→DERIVED_PUBLISHED, map layer served); a rejecting outcome blocks publication and routes the mission to reprocessing. Identifiers are runtime UUIDs (see notes.id_format).",
  "type": "object",
  "properties": {
    "event_id": {
      "$ref": "#/$defs/Uuid",
      "description": "Unique event identifier (platform DomainEvent base — uuid4)"
    },
    "event_type": {
      "type": "string",
      "const": "expert.review_decided",
      "description": "Event type (constant)"
    },
    "event_version": {
      "type": "string",
      "const": "1.0",
      "description": "Event schema version"
    },
    "occurred_at": {
      "$ref": "#/$defs/Timestamp",
      "description": "When the verdict was submitted (ISO 8601 UTC)"
    },
    "data": {
      "$ref": "#/$defs/ExpertReviewDecidedData",
      "description": "Event-specific data"
    },
    "metadata": {
      "$ref": "#/$defs/EventMetadata",
      "description": "Event correlation/tracing metadata"
    }
  },
  "required": [
    "event_id",
    "event_type",
    "event_version",
    "occurred_at",
    "data"
  ],
  "unevaluatedProperties": false,
  "$defs": {
    "Uuid": {
      "type": "string",
      "format": "uuid",
      "description": "RFC 4122 UUID (runtime identifier format across platform/worker)"
    },
    "Timestamp": {
      "type": "string",
      "format": "date-time",
      "description": "ISO 8601 timestamp (UTC)"
    },
    "ExpertReviewDecidedData": {
      "type": "object",
      "title": "Expert Review Decided Data",
      "description": "Verdict and the resulting publication gate decision.",
      "properties": {
        "review_id": {
          "$ref": "#/$defs/Uuid",
          "description": "Expert review that was decided (expert_reviews.review_id)"
        },
        "analysis_result_id": {
          "$ref": "#/$defs/Uuid",
          "description": "Analysis result the verdict applies to"
        },
        "mission_id": {
          "$ref": "#/$defs/Uuid",
          "description": "Mission the result belongs to"
        },
        "field_id": {
          "$ref": "#/$defs/Uuid",
          "description": "Field the mission belongs to"
        },
        "expert_user_id": {
          "type": "string",
          "description": "Pseudonymous identifier of the deciding expert (no PII per KR-050/KR-071)"
        },
        "verdict": {
          "type": "string",
          "enum": ["confirmed", "corrected", "rejected", "needs_more_expert"],
          "description": "Expert verdict — aligned with worker/expert_feedback.v1 and platform/training_feedback.v1."
        },
        "gate_outcome": {
          "type": "string",
          "enum": ["APPROVED_PUBLISHED", "REJECTED", "ESCALATED"],
          "description": "Publication gate result derived from the verdict: confirmed/corrected→APPROVED_PUBLISHED (farmer publication authorised); rejected→REJECTED (no publication, mission reprocessed); needs_more_expert→ESCALATED (awaiting another expert, no publication yet)."
        },
        "training_grade": {
          "type": ["string", "null"],
          "enum": ["A", "B", "C", "D", "REJECT", null],
          "description": "Optional training data grade (KR-029). Null when not graded."
        },
        "decided_at": {
          "$ref": "#/$defs/Timestamp",
          "description": "Verdict timestamp (ISO 8601 UTC)"
        }
      },
      "required": [
        "review_id",
        "analysis_result_id",
        "mission_id",
        "verdict",
        "gate_outcome",
        "decided_at"
      ],
      "unevaluatedProperties": false
    },
    "EventMetadata": {
      "type": "object",
      "title": "Event Metadata",
      "description": "Event correlation and tracing metadata",
      "properties": {
        "correlation_id": {
          "type": "string",
          "description": "Correlation ID for tracing related events"
        },
        "causation_id": {
          "type": "string",
          "description": "ID of event/command that caused this event"
        },
        "trace_id": {
          "type": "string",
          "description": "Distributed tracing ID"
        },
        "source_service": {
          "type": "string",
          "description": "Service that emitted the event"
        }
      },
      "unevaluatedProperties": false
    }
  },
  "examples": [
    {
      "event_id": "1a2b3c4d-5e6f-4071-8293-a4b5c6d7e8f9",
      "event_type": "expert.review_decided",
      "event_version": "1.0",
      "occurred_at": "2026-06-15T11:20:00Z",
      "data": {
        "review_id": "a1b2c3d4-e5f6-4071-8293-a4b5c6d7e8f9",
        "analysis_result_id": "b2c3d4e5-f6a7-4182-93a4-b5c6d7e8f9a0",
        "mission_id": "c3d4e5f6-a7b8-4293-a4b5-c6d7e8f9a0b1",
        "field_id": "d4e5f6a7-b8c9-43a4-b5c6-d7e8f9a0b1c2",
        "expert_user_id": "expert-7421",
        "verdict": "confirmed",
        "gate_outcome": "APPROVED_PUBLISHED",
        "training_grade": "A",
        "decided_at": "2026-06-15T11:20:00Z"
      },
      "metadata": {
        "correlation_id": "corr_mission_123",
        "causation_id": "9b2e6f7a-3c41-4d58-8a7b-1f2e3d4c5b6a",
        "source_service": "platform-expert-portal"
      }
    }
  ],
  "notes": {
    "lifecycle": "ACTIVE — uyumlu platform üreticisi mevcut. Platform-expert-portal submit_review + bulk_approve (expert_portal.py) GERÇEK N-uzman konsensüs kapı kararıyla bu wire olayını yayınlar (ExpertReviewDecidedV1, expert_gate_events.py → domain.events exchange, routing event.expert.review_decided). (SYNC-1 hizalandı 2026-06-23 / Faz 3)",
    "gate_semantics": "This event is the publication gate. Only gate_outcome=APPROVED_PUBLISHED authorises farmer-facing delivery. REJECTED and ESCALATED keep the result hidden from the farmer.",
    "verdict_mapping": "gate_outcome is the REAL N-expert consensus gate decision, NOT a naive per-verdict mapping (avoids premature farmer publication): APPROVED_PUBLISHED only when consensus is complete AND no rejection (mission→DONE, dataset→DERIVED_PUBLISHED); REJECTED when this or a sibling verdict rejects and consensus is complete (mission→EXPERT_REJECTED, no publication); ESCALATED while sibling reviews are still pending OR verdict=needs_more_expert (publication withheld). For the single-reviewer case this collapses to confirmed|corrected→APPROVED_PUBLISHED, rejected→REJECTED, needs_more_expert→ESCALATED.",
    "id_format": "Identifiers are RFC 4122 UUID strings to match the running platform wire format (platform DomainEvent base emits str(uuid4)). See analysis_review_requested.v1 notes.id_format.",
    "pii_free": "No PII. expert_user_id is a pseudonymous identifier (KR-050/KR-071)."
  }
}
