{
  "event_id": "1a2b3c4d-5e6f-4071-8293-a4b5c6d7e8f9",
  "event_type": "expert.review_decided",
  "event_version": "1.0",
  "occurred_at": "2026-06-15T11:20:00Z",
  "data": {
    "review_id": "a1b2c3d4-e5f6-4071-8293-a4b5c6d7e8f9",
    "analysis_result_id": "b2c3d4e5-f6a7-4182-93a4-b5c6d7e8f9a0",
    "mission_id": "c3d4e5f6-a7b8-4293-a4b5-c6d7e8f9a0b1",
    "field_id": "d4e5f6a7-b8c9-43a4-b5c6-d7e8f9a0b1c2",
    "expert_user_id": "expert-7421",
    "verdict": "confirmed",
    "gate_outcome": "APPROVED_PUBLISHED",
    "training_grade": "A",
    "decided_at": "2026-06-15T11:20:00Z"
  },
  "metadata": {
    "correlation_id": "corr_mission_123",
    "causation_id": "9b2e6f7a-3c41-4d58-8a7b-1f2e3d4c5b6a",
    "source_service": "platform-expert-portal"
  }
}
